{
  "schemaVersion": 1,
  "registryVersion": "2026-10-28-normalized-80-v1",
  "updatedAt": "2026-10-28",
  "updatedBy": "ChatGPT",
  "formats": [
    "webp",
    "png",
    "svg"
  ],
  "renderPolicy": {
    "prototype": {
      "allowRights": [
        "OWNED",
        "LICENSED",
        "EMBED_PERMITTED",
        "UNVERIFIED"
      ],
      "allowStatus": [
        "ACTIVE",
        "PLACEHOLDER"
      ]
    },
    "production": {
      "allowRights": [
        "OWNED",
        "LICENSED",
        "EMBED_PERMITTED"
      ],
      "allowStatus": [
        "ACTIVE"
      ]
    },
    "preview": {
      "allowRights": [
        "OWNED",
        "LICENSED",
        "EMBED_PERMITTED"
      ],
      "allowStatus": [
        "ACTIVE",
        "PLACEHOLDER",
        "CANDIDATE"
      ]
    }
  },
  "slots": {
    "cover-desktop-art": {
      "label": "Cover page artwork, desktop (left page of the open spread)",
      "placement": "index.html ≥1024px: .pg-cover background, under masthead, topic, teasers and cover lines",
      "renderBox": {
        "width": 629,
        "height": 1213,
        "note": "CSS px at 100% reader zoom; scaled with the spread"
      },
      "deliver": {
        "width": 1260,
        "height": 2440,
        "formats": [
          "webp",
          "png",
          "svg"
        ],
        "maxBytes": 550000,
        "expectedFile": "assets/art/cover-desktop-art.v{n}.webp"
      },
      "fit": "cover",
      "defaultFocal": {
        "x": 0.62,
        "y": 0.4
      },
      "overlay": "cover-shade",
      "safeZones": [
        {
          "name": "masthead",
          "x": 0,
          "y": 0,
          "w": 1,
          "h": 0.25,
          "rule": "dark, low detail: MOSPORT and More than sport sit here"
        },
        {
          "name": "topic",
          "x": 0,
          "y": 0.25,
          "w": 0.6,
          "h": 0.32,
          "rule": "low contrast: THIS ISSUE, NBA GAME DAY, tagline"
        },
        {
          "name": "teasers",
          "x": 0,
          "y": 0.55,
          "w": 0.75,
          "h": 0.33,
          "rule": "low contrast: Breaking News / Exclusive headlines"
        },
        {
          "name": "footer",
          "x": 0,
          "y": 0.88,
          "w": 1,
          "h": 0.12,
          "rule": "dark: cover lines and Be Your Own Coach"
        },
        {
          "name": "subject",
          "x": 0.42,
          "y": 0.18,
          "w": 0.58,
          "h": 0.45,
          "rule": "main subject (ball, hoop, light) goes here"
        }
      ],
      "allowedKinds": [
        "equipment",
        "court",
        "arena",
        "lights",
        "crowd-abstract",
        "geometry",
        "brush"
      ],
      "fallback": {
        "kind": "gradient",
        "light": "radial-gradient(120% 70% at 75% 35%, #1D4FC4 0%, #0E2A66 38%, #0B1A3D 70%), #0B1A3D",
        "dark": "radial-gradient(120% 70% at 75% 35%, #163C99 0%, #0A1F4D 38%, #071433 70%), #071433"
      },
      "activeVersion": "placeholder-v1",
      "versions": [
        {
          "id": "placeholder-v1",
          "status": "PLACEHOLDER",
          "file": "assets/art/cover-art.placeholder-v1.svg",
          "format": "svg",
          "width": 1000,
          "height": 1300,
          "sha256": "40a7b37036c66d49b64be5eb15d6088a267d561dede5b2265406e74ee528ea73",
          "darkFile": null,
          "crops": {
            "desktop": {
              "focal": {
                "x": 0.62,
                "y": 0.4
              }
            }
          },
          "content": {
            "kinds": [
              "equipment",
              "court",
              "arena",
              "lights",
              "crowd-abstract"
            ],
            "containsText": false,
            "containsLogo": false,
            "containsPerson": false
          },
          "rights": {
            "status": "OWNED",
            "licence": "Original MOSPORT-B development placeholder",
            "owner": "MOSPORT",
            "source": "Vector: ball, hoop, arena lights, crowd pattern, court",
            "generator": null,
            "generatorPrompt": null,
            "attribution": null
          },
          "provenance": {
            "addedBy": "MOSPORT-B engineering",
            "addedAt": "2026-10-28T15:45:00+08:00",
            "approvedBy": null,
            "approvedAt": null
          }
        },
        {
          "id": "claude-crop-v1",
          "status": "CANDIDATE",
          "file": "assets/art/cover-desktop-art.v1-claude-crop.webp",
          "darkFile": null,
          "format": "webp",
          "width": 1260,
          "height": 2440,
          "sha256": "04e7e7cc91efccaf3797091319bd2547adfbacca347e823d8bd139d6c7ac7d9f",
          "crops": {
            "desktop": {
              "focal": {
                "x": 0.62,
                "y": 0.3
              }
            }
          },
          "content": {
            "kinds": [
              "equipment",
              "court",
              "arena",
              "lights",
              "crowd-abstract",
              "brush"
            ],
            "containsText": false,
            "containsLogo": false,
            "containsPerson": false
          },
          "rights": {
            "status": "OWNED",
            "licence": "Original generated artwork for MOSPORT (Founder-supplied)",
            "owner": "MOSPORT",
            "source": "MOSPORT_B_Original_Five_Panel_Art_Source_20261028.png, region 10,7,537,1015 (left,top,right,bottom px); cover crop to 1260×2440 (Lanczos), no stretch. Source sha256 94cb4629b2dd14e39319aef5eef11cddcfac5fbad2f8004c8faa32e231a7b48f",
            "generator": "ChatGPT ImageGen",
            "generatorPrompt": null,
            "attribution": null,
            "sourceUrl": "https://drive.google.com/file/d/1VSBmjPt9b3iv19h_mTy60ngx4QxN__K_/view?usp=drivesdk"
          },
          "provenance": {
            "addedBy": "MOSPORT-B engineering (crop/export from Founder-supplied source)",
            "addedAt": "2026-10-28T16:10:00+08:00",
            "approvedBy": null,
            "approvedAt": null,
            "notes": "Crowds are distant, non-identifiable texture. Arena boards carry illegible glyph-like marks, no readable text or marks. Upscaled from a ~0.4 MP panel: soft at 100% on large screens. Alternative crop made by Claude Code from the same source sheet before the ChatGPT package arrived; kept for comparison only."
          }
        },
        {
          "id": "native-illustration-v2",
          "status": "CANDIDATE",
          "file": "assets/art/cover-desktop-art.v2.webp",
          "darkFile": null,
          "format": "webp",
          "width": 1260,
          "height": 2440,
          "sha256": "95311122c4f291f6d9aa85e6ed70bb62ba41d845beef2219459940bcc3b3763c",
          "crops": {
            "desktop": {
              "focal": {
                "x": 0.62,
                "y": 0.4
              }
            },
            "mobile": {
              "focal": {
                "x": 0.62,
                "y": 0.4
              }
            }
          },
          "content": {
            "kinds": [
              "equipment",
              "arena",
              "court",
              "lights",
              "geometry"
            ],
            "containsText": false,
            "containsLogo": false,
            "containsPerson": false
          },
          "rights": {
            "status": "OWNED",
            "licence": "Original procedural illustration candidate; internal design review only",
            "owner": "MOSPORT",
            "source": "MOSPORT_B_Native_Editorial_Art_v2 locally available generated illustration sources",
            "generator": "procedural vector/raster illustration",
            "generatorPrompt": "MOSPORT navy/orange basketball equipment and arena art; no people, text, or logos",
            "attribution": null
          },
          "provenance": {
            "addedBy": "ChatGPT MOSPORT-B visual review",
            "addedAt": "2026-10-28T18:42:00+08:00",
            "approvedBy": null,
            "approvedAt": null,
            "note": "Standalone native-size procedural illustration, NOT the painterly high-detail final approved artwork."
          }
        },
        {
          "id": "chatgpt-art-v1",
          "status": "CANDIDATE",
          "file": "assets/art/cover-desktop-art.v1.webp",
          "darkFile": null,
          "format": "webp",
          "width": 1260,
          "height": 2440,
          "sha256": "bcc42f5e5ddcccb0584f6eff56977c2a1a65cc4c542ff65fd594c48497986b13",
          "crops": {
            "desktop": {
              "focal": {
                "x": 0.62,
                "y": 0.4
              }
            },
            "mobile": {
              "focal": {
                "x": 0.5,
                "y": 0.6
              }
            }
          },
          "content": {
            "kinds": [
              "equipment",
              "arena",
              "lights",
              "geometry",
              "court"
            ],
            "containsText": false,
            "containsLogo": false,
            "containsPerson": false
          },
          "rights": {
            "status": "OWNED",
            "licence": "AI-generated original MOSPORT art; internal candidate pending Founder review",
            "owner": "MOSPORT",
            "source": "Original generation in ChatGPT, 2026-10-28",
            "generator": "ChatGPT ImageGen",
            "generatorPrompt": "No people, no player likenesses, no text, no logos; cinematic basketball equipment and empty arena in editorial navy/orange style; five art-only panels for responsive MOSPORT slots",
            "attribution": null
          },
          "provenance": {
            "addedBy": "ChatGPT / MOSPORT-B visual art",
            "addedAt": "2026-10-28T15:00:00+08:00",
            "approvedBy": null,